step	phase	title	goal	allowed_changes	forbidden_changes	done_when	risk
1	M1B_ARTIFACT_IMPLEMENTATION	Secure Artifact Backend	Implement storage, metadata and signed download minimums in the backend.	backend/app/routers/artifacts.py; backend/app/schemas/artifacts.py; backend/app/services/artifact_storage.py; backend/app/services/artifact_signing.py; backend/app/main.py include_router only; tests/test_artifacts_contract.py; docs/audit/external-ens-unified-migration-m1b-artifact-implementation/**	frontend changes; Docker; auth refactors; migrations without authorization; vendoring external code	Artifact upload/download/auth/RBAC/audit are passing in tests.	HIGH
2	M1C_ARTIFACT_UAT	Artifact UAT	Validate upload/download/auth/RBAC/audit against the new contract.	test-only docs and notes; no product code	frontend changes; Docker; auth refactors	Artifact contract test suite and audit notes are green.	MEDIUM
3	M2B_CHAT_BRIDGE_MOCK_ADAPTER	Chat Bridge Mock	Implement a server-side mock adapter for chat runs and events without provider calls.	backend-owned adapter files and contract tests	frontend changes; provider calls; Docker	Mock run/create/event flows are deterministic and secure.	HIGH
4	M3B_RAG_MCP_MOCK_ADAPTER	RAG MCP Mock	Implement allowlisted RAG adapter behavior without live provider/vector dependencies.	backend-owned adapter files and contract tests	frontend changes; raw MCP exposure; secrets in UI	Search, collections and audit behavior are deterministic.	HIGH
5	M4B_DESIGNER_MOCK_ADAPTER	Designer Mock	Implement jobs/templates mock flows without live provider generation.	backend-owned adapter files and contract tests	frontend changes; provider integration; Docker	Job creation/status/download contract is stable and safe.	HIGH
6	M5_UI_GATE_DECISION	Apoema UI Gate	Decide when to expose new entries in Apoema after backend adapters exist.	docs-only decision memo; optional allowlisted route wiring	AuthProvider; ProtectedRoute; CSS; Docker	UI gate is approved only after backend contracts are proven.	MEDIUM
7	M6_AUTHENTICATED_E2E	Authenticated E2E	Run end-to-end validation with storageState outside the repo.	tests and docs only; no secrets committed	storageState/cookies/tokens in repo	Authenticated smoke and contract paths pass from Apoema.	MEDIUM
8	M7_PRE_PUSH_FINAL	Final Gates	Run the final pre-push checklist once all adapters are stable.	docs and selective fixes only	blind push, broad staging, destructive cleanup	All validation gates pass and the repo stays boundary-clean.	LOW
