candidate	source_path	target_area	target_path_proposed	decision	phase	priority	risk	dependencies	tests_required	notes
artifact-server	services/artifact-server/src/server.js	backend/contracts	services/artifact-server	APPROVE_FOR_CONTRACT_MIGRATION	M1_ARTIFACT_SERVER_CONTRACT	high	medium	chat-bridge	contract tests for upload/metadata/content/access-link/delete	First boundary to stabilize; backend-owned.
chat-bridge	services/chat-bridge/src/server.js	backend/adapter	services/chat-bridge	APPROVE_FOR_ADAPTER_DESIGN	M2_CHAT_BRIDGE_HERMES_ADAPTER	high	medium	artifact-server + hermes-runtime	integration tests for SSE/runs/session/delete/link rewriting	Depends on artifact server contract.
rag-mcp	services/rag-mcp/src/index.ts	external service	services/rag-mcp	APPROVE_FOR_ADAPTER_DESIGN	M3_RAG_MCP_EXTERNAL_SERVICE	high	medium	supabase config + mcp transport	health + /mcp transport tests	Keep as external MCP service.
designer-api	apps/designer-api/api/app.py	optional module	apps/designer-api	APPROVE_FOR_ADAPTER_DESIGN	M4_DESIGNER_API_MODULE	medium	medium	job orchestration + file access controls	FastAPI route tests and auth/file access tests	Expose only through backend adapter and authenticated DTOs.
chat-web	apps/chat-web/src/App.tsx	frontend shell	Apoema UI	DO_NOT_MIGRATE	M5_APOEMA_UI_ENTRYPOINTS	medium	high	current AuthProvider + ProtectedRoute	visual regression + route smoke	Reference only; do not reintroduce legacy shell.
hermes-runtime	services/hermes-runtime/.env.example	runtime orchestration	services/hermes-runtime	DO_NOT_MIGRATE	M7_PRE_PUSH_CHECKLIST	medium	high	current deployment scripts	ops smoke only	Keep separate from Apoema UI/runtime.
vendor-hermes-agent	services/hermes-runtime/vendor/hermes-agent/**	vendor subtree	vendor/hermes-agent	QUARANTINE_SECURITY_REVIEW	M7_PRE_PUSH_CHECKLIST	low	very high	upstream vendor review	narrow interface review only	Do not migrate wholesale.
