phase	title	goal	allowed_changes	forbidden_changes	done_when	risk
M1_ARTIFACT_SERVER_CONTRACT	Artifact Server Contract	stabilize upload/metadata/content/access-link contract	docs, DTOs, contract tests, adapter boundaries	frontend shell, chat-web, vendor subtree, runtime compose	contract tests pass and artifact lifecycle is documented	medium
M2_CHAT_BRIDGE_HERMES_ADAPTER	Chat Bridge Hermes Adapter	wire chat bridge to the stabilized artifact contract	bridge adapter docs, DTOs, SSE contract tests	direct provider calls from frontend, runtime changes outside adapter	bridge can run with authenticated session flow and audited link rewriting	medium
M3_RAG_MCP_EXTERNAL_SERVICE	RAG MCP External Service	keep RAG as an independent MCP service or adapter	service boundary docs, health/transport tests, config maps	front-end direct provider coupling, auth contract changes	service health and /mcp transport are stable with no UI provider access	medium
M4_DESIGNER_API_MODULE	Designer API Module	treat designer API as optional backend module behind auth	DTOs, file access policy, job status API docs/tests	frontend runtime replacement, auth contract changes	banner/job API is explicit and auditable behind backend	medium
M5_APOEMA_UI_ENTRYPOINTS	Apoema UI Entrypoints	only after backend/adapter boundaries are fixed	entrypoint mapping docs, visual smoke, route contract docs	reintroducing legacy AppShell/AuthProvider/ProtectedRoute clones	Apoema routes render without legacy shell regressions	high
M6_AUTHENTICATED_UAT	Authenticated UAT	run manual smoke with isolated storageState outside repo	UAT checklist, browser smoke notes, evidence storage outside repo	.env, cookies, tokens, storageState in repo	authenticated smoke passes and evidence stays out of version control	high
M7_PRE_PUSH_CHECKLIST	Pre-push Checklist	final gate before any push	git diff checks, secret scans, stage boundary review	push, force-push, merge, rebase, clean -fdx	docs-only or code-only changes are isolated and verified	high
